{
  "acceptance_id": "accept-hostile-review-20260819",
  "attestation": "unsigned-local-recorder",
  "host_execution_digest": "sha256:2d5d0263c2b5f3021786534bfef7009bf5cf42489fff4434b11bef2cb0afa427",
  "issues": [],
  "model_artifact_ledger": [
    {
      "digest": "sha256:744fcc76013472141dba38c09dd43bf39b309032b76560c41bd0f12c91445474",
      "path": "run.json"
    },
    {
      "digest": "sha256:f681beedd852444f1683eb4109852601f0051d70ec18942b28a7fd3222802e01",
      "path": "report.json"
    },
    {
      "digest": "sha256:29b34bd35ee42444eeec6ead89651fb6f7a39e3c75ff427913bfcabc5400e83e",
      "path": "method-results/evidence-quality.json"
    },
    {
      "digest": "sha256:948dc6db1b18d83c3db47d880155186baea1f27e771cf3eaebc61032069c1eba",
      "path": "method-results/key-assumptions.json"
    },
    {
      "digest": "sha256:705e6d2640ea0bd84931724cdb1e0e07673f01d52f7051b3e552bd59149445e0",
      "path": "method-results/devils-advocacy.json"
    }
  ],
  "profile": "standard-review",
  "prompt_digest": "sha256:dc7007ec8eef4e1b1f2d20f825cb2779d92778d93041ccb9c75000170241e7e0",
  "run_side_conditions": [
    "CORRELATED"
  ],
  "run_status": "INCOMPLETE",
  "run_verification_digest": "sha256:b8fe82d8f0180246665e444c474d86025caef229cfd4d6782bb5c284701bdf8d",
  "schema_version": "0.1.0",
  "source_commit": "7da73bbeef496cff9e31828e97a3fb400f44ead5",
  "source_tree": "03af9cb01c76f454b7182e428b7de0d760051b50",
  "task": "hostile-review",
  "task_digest": "sha256:f6815806903763fb6fafcf56f8d0a195a2db9a2aa7d9eab592cf6c1727a86bb6",
  "valid": true
}
