{
  "acceptance_id": "accept-investigation-duplicates-20260819",
  "attestation": "unsigned-local-recorder",
  "host_execution_digest": "sha256:25d35ee26cf9fa95426abf751baf4ebb8ad521d6f8e25d7f466f9c2b42f2cc3e",
  "issues": [],
  "model_artifact_ledger": [
    {
      "digest": "sha256:eaa561a90a5130af5c5704a3c61ace6a6d58fd8658a21391bc2684a05b40650e",
      "path": "run.json"
    },
    {
      "digest": "sha256:dac108167e91c1f55a4190577cd4fa1c0afe7af7dad8d62be3dbe0c9f757c259",
      "path": "report.json"
    },
    {
      "digest": "sha256:a6020b89dfbb67a2b86093e8e08f6496de75bd51bb906db4b06ff5dae190db1c",
      "path": "method-results/evidence-quality.json"
    },
    {
      "digest": "sha256:0ce85df811971da0f03a1e1c4c864be74e574bc6b662533c25711efc93929726",
      "path": "method-results/competing-hypotheses.json"
    },
    {
      "digest": "sha256:e51c3fbbefc0d2e09166630cc195eff7604ac687e47522d0a4a316275c58bdda",
      "path": "method-results/devils-advocacy.json"
    }
  ],
  "profile": "standard-investigation",
  "prompt_digest": "sha256:cbb79562bd75aa8b29650eb17f6b5e203746ecb7392a38485c6e1aec6f799edc",
  "run_side_conditions": [
    "CORRELATED"
  ],
  "run_status": "INCOMPLETE",
  "run_verification_digest": "sha256:93a2e5ffa4f51eb7dd1e9ec51411803029b23d2598e3f2f7a5ec0198fdbcbdb9",
  "schema_version": "0.1.0",
  "source_commit": "7da73bbeef496cff9e31828e97a3fb400f44ead5",
  "source_tree": "03af9cb01c76f454b7182e428b7de0d760051b50",
  "task": "investigation-duplicates",
  "task_digest": "sha256:d15c51f0b1b610efd065debf933ad1c61152853eaec132185a768906983957a5",
  "valid": true
}
