{
  "acceptance_id": "accept-architecture-storage-20260819",
  "attestation": "unsigned-local-recorder",
  "host_execution_digest": "sha256:0bb883b4f0a7425bb1fbdba708afbc29e180c6d9bf180fe09907335875631348",
  "issues": [],
  "model_artifact_ledger": [
    {
      "digest": "sha256:2bfe8f614207e07c55ada5c2a3ca15481388325d95c548a855f8e5473d3f47e6",
      "path": "run.json"
    },
    {
      "digest": "sha256:29212d1986cdd07905543e7e1c5f8f0e64d8d15dd301c9fac319d37ce875d26b",
      "path": "report.json"
    },
    {
      "digest": "sha256:9e13c1254bc628809561cee1e1f4a5448b06e419dee5980178f5e5192dc2d2d5",
      "path": "method-results/key-assumptions.json"
    },
    {
      "digest": "sha256:d7db11447d2bd0f966c87a0f85ba4d130f99d5db03c4873245e4b12e79392c9c",
      "path": "method-results/systems-trade-study.json"
    },
    {
      "digest": "sha256:5b6109c6db308734cd9fe6946eceb5a6dc909e43e7a320e1134ccea48f3ac98f",
      "path": "method-results/failure-modes.json"
    },
    {
      "digest": "sha256:735d84d3f45fa03d93cece6db6db196c154f840ede0ac88068fa56598ddb49bc",
      "path": "method-results/devils-advocacy.json"
    }
  ],
  "profile": "standard-architecture",
  "prompt_digest": "sha256:fb7d0506dcefec339ed9a897fa425e2eca1cae026d234f9243e837740335d7cd",
  "run_side_conditions": [
    "CORRELATED"
  ],
  "run_status": "INCOMPLETE",
  "run_verification_digest": "sha256:dc34ec48fed92dfc2b41e66eeb4cd89e460aaf6703046a74f824cdf5f492831d",
  "schema_version": "0.1.0",
  "source_commit": "7da73bbeef496cff9e31828e97a3fb400f44ead5",
  "source_tree": "03af9cb01c76f454b7182e428b7de0d760051b50",
  "task": "architecture-storage",
  "task_digest": "sha256:03b8bcc62e28d99d570bb92dd3492e6611134040776ac7f0ae4f0358e1e5977a",
  "valid": true
}
